6/9/2022 10:57,2395.32,Dharmajan Sharma,90eafc98c6d90ac68e47e1b8cf0ebedcbe3a442bc1efc656dabab63e7b78898b,Barman-Chad,2006,Sagar,USD,Visa,Jan-32,21eb478c997305f06e5e0d043d3ec5acc63a85938da69e14f239f34a8348fc54,12,2529ded9-1b5a-4fbf-8c5e-24f2d4149ed6,0,1,In-Person,42.234.2.140,Desktop,msood,Ducimus nostrum ipsum accusamus iste. Adipisci quos nam veniam omnis. Fugiat ad eum minima autem dolores.
5/3/2020 21:52,2832.06,Baiju Ganesan,24ab848c31bbde35009942495e6145a1a8857c8da1d131e6dcfdee16fdcd5fdc,Badal LLC,4348,Gaya,USD,MasterCard,Jul-33,f747870ae666c39b589f577856a0f7198b3b81269cb0326de86d8046f2cf72db,05,dc0c8a1f-5d8b-4260-b3c5-ef3a1f41a6f2,0,1,Online,5.66.162.173,Mobile,hiran66,"Eos corrupti quidem cumque placeat ipsum. A amet maiores ipsum deleniti consequatur soluta.
Magnam quod animi facilis accusantium."
9/5/2020 10:07,3806.5,Kavya Khosla,1403a456cfba00871b948372e6bb06632716e833630a90ef2cd8425711958170,Sridhar-Vora,2920,Agra,INR,MasterCard,29-Feb,ca0cec7f60085f0289aaea5cbfbdd84ad2ba05148de121075dab1c636682a566,00,c8a21922-b37d-4c07-847e-c916144f9d8f,0,2,In-Person,206.189.166.83,Desktop,,"Sint quae exercitationem esse.
Numquam officiis molestiae temporibus saepe. Recusandae quas consequatur quos inventore esse debitis. Sunt quaerat quaerat labore numquam officiis."
12/22/2020 19:48,117.9,Sumer Raman,f339ed6aa2e0dc73eb6f791daaa132faccb80d186031873fb0720442c1c9fc49,Bains Ltd,8983,Morbi,USD,Visa,25-Apr,33de253288ec0ae86ccb537636875ea4da12a51ba1b98b336cf2298d8cc1861b,05,481e06a9-e35c-4d12-abcd-091782327f08,0,None,In-Person,220.154.192.23,Desktop,hshankar,Nihil corporis nobis est veritatis alias quod sequi. Necessitatibus quis reiciendis. Vero animi placeat iure doloremque dolorem eos. Maiores dicta perferendis soluta saepe.
4/7/2020 22:00,3598.28,Jhanvi Bera,7fc4fcf2912d90fd12c274e209513ff5a02b8dc9cf18855e7cf84d82007bc960,Dyal-Kashyap,9036,Panipat,USD,MasterCard,24-Jun,d11501b090fb2749f2c49284394dd36fe0ac76eb1a52cb3bba260dbc119ec46e,00,4aa5091d-eefc-43d7-b7c7-36833c8aa0e6,0,None,Online,5.241.125.118,Tablet,,"Esse est velit molestias. Asperiores nam aperiam qui.
Beatae dolor ullam. Ut temporibus consectetur labore ab alias quas quas."
10/27/2020 03:44,1145.04,Emir Bahl,bf167e8abf16d5d417a676d1cf483c118b3f95ce4b863918797b9225f9c54ddc,"Agarwal, Banik and Loyal",8748,Dindigul,EUR,Visa,31-Jan,82c01ce15b431d420eb6a1febfba7d7a2b69e5bcdcb929cb42cd3e9179d43fc4,00,df5fbfc0-7dda-4bdf-ad44-82f568c0a03a,0,2,Online,166.70.183.126,Desktop,ivanashah,"Sunt fugit est corrupti nostrum. Ipsam neque excepturi quos.
Possimus maiores maxime iusto non ab quidem.
Ratione voluptates ex laboriosam ex at numquam dolorem. Impedit voluptatum in dolorem."
12/27/2021 12:15,2376.9,Saanvi Vyas,e24b36fbfccd1bb041680898f0727bdc7071f1c16640787ac3965960671061d4,Zacharia LLC,3925,Ludhiana,EUR,Visa,29-Sep,e73cb135243c08ab2c2adc333b150b9237093315f6b38e3361f07caf2bfb4d6b,00,013738c0-aa34-41ac-930a-c7839ef7a04a,0,3 or more,Online,21.69.21.11,Mobile,,Harum voluptate quibusdam illo commodi a dolore.
5/23/2023 05:29,4604.88,Samarth Anand,d7cc23df51e13f759817e64a56bb24a2fdbdcc9c3134ad8ab719956976c1dfc7,Dash-Subramanian,4354,Thanjavur,INR,Visa,29-Jan,eaf89db7108470dc3f6b23ea90618264b3e8f8b6145371667c4055e9c5ce9f52,05,af47a3e1-0ddc-46be-a22e-06cfec30d2ad,0,None,Online,1.154.252.63,Desktop,nkeer,Ab occaecati accusamus. Soluta voluptas explicabo temporibus et vero quam. Molestiae dolor laudantium.
4/26/2021 11:33,4920.95,Anahita Shah,5a8d5a481f657614a63a2279c0dae1d653411f84b84d33729c35b7c4c8982d1d,"Wason, Seth and Sood",7815,Katihar,EUR,MasterCard,25-Dec,01ce4b291ad3ecd240be71870340051b755e74e91e05d5c5baa0d7830c1b75d4,05,d4cb2811-9025-494f-8a50-242f5b875881,0,3 or more,Online,218.251.7.177,Desktop,,Culpa maiores neque aliquid. Nulla molestiae commodi mollitia atque dolore perferendis. Exercitationem repudiandae ad eum.
2/4/2023 06:40,132.21,Dhanush Gala,6069994de5f376c24d4686b3a5c28d787769cc43d9d18675cb898c539bf2af93,"Bir, Chawla and Kala",8769,Sambhal,INR,American Express,25-Apr,ecac903ea62dc1d5446a88330af0a17ce89c7787e5aaf450113a4a426813e3cc,05,37d40d22-56d0-47db-8bf1-3ed571b72e45,0,None,Online,74.220.66.5,Mobile,,"Velit reiciendis fugiat accusantium maiores tenetur molestias.
Quas saepe eligendi sunt exercitationem. In optio veritatis dolorem deserunt."
5/19/2021 04:08,1521.27,Zara Shanker,535b587dda648d5454c1d8333dbfb9edee67f63a98a2cb721a8765e543475043,Kadakia and Sons,6545,Tadepalligudem,USD,MasterCard,Mar-32,04222ea3e14cb1209b9726defe3efce5196b7afa0a959854a30401be41f4026d,05,e3f73393-5f5c-461b-96db-7e4987ee31f0,0,2,In-Person,179.146.5.27,Desktop,vohraaaina,Aliquam minus veritatis molestias dicta mollitia nemo. Molestiae dolorem praesentium rerum facere. Repudiandae nobis molestiae ducimus repudiandae. Enim possimus delectus.
8/26/2021 08:46,3644.02,Piya Bala,23a450ee3328f05710ac93d92f19e210e97250f503c92e919a7de3307f7ab447,Tara-Sachdev,8240,Amroha,EUR,MasterCard,Jun-33,c498f3fe97c0df55ee8dea01a72572059b93f42d235a5e439e9c9a1654d6d4e1,00,40393943-508b-4eb3-8e5b-8acb58064456,0,None,Online,104.78.216.123,Mobile,lhans,"Optio facilis suscipit recusandae quae tempore. Eveniet ullam iusto repudiandae unde recusandae.
Debitis autem cumque voluptatibus nisi ipsum natus atque. A omnis id quisquam earum."
9/20/2020 16:26,2376.21,Umang Comar,b6698c08c6ed1f02af028e384c3c9e96aa66e3fdf92ae0b10709312342dfd34b,Saraf Ltd,2535,Orai,EUR,American Express,Jun-32,0230a7f0e3ccb489d22c25507b3976a65addd02f3e44cd6e8f2b4e46cd7bce8e,00,63755ac0-51c6-4f1e-a311-f75a8680f991,0,None,In-Person,159.176.230.145,Mobile,,"Accusantium dolores quidem illum doloremque accusamus quod. Doloribus cumque perspiciatis aspernatur tempora dolores.
Quia soluta natus tempore. Eius ullam ab corporis."
4/25/2020 04:31,1256.09,Nirvaan Varma,c0995f08e1e0c66090e9ade1b60b78eef2727fc507c7a62d8dd6d7f1fe735e11,"Bali, Sankaran and Devan",6654,Vadodara,USD,MasterCard,27-Jun,dfe62e836a0a6f2633422230c81287700a56e2639652c73f264e6562220c207a,12,ff0b3ad7-49ef-48a2-87ce-443acc85e5c8,0,1,Online,38.123.223.84,Desktop,,"Ullam quam et et porro aut eius. Laborum perspiciatis accusantium eaque esse.
Ad hic perferendis quaerat omnis. Voluptatibus aliquam voluptates deserunt minima asperiores."
5/19/2023 23:39,1413.82,Indrajit Sangha,e07ca90c65e9ebdc9ab297c6592ed34b825db09e309d764192292ddc2cf0e155,"Rama, Brar and Babu",9702,Bhatpara,INR,Visa,Jun-31,a4e987d17584557e2fbed011cddf66dc5185338bc3ef33d4226f86c32b7364dd,05,65dd014b-aaab-4da4-813b-a8d3c1232e17,0,2,In-Person,161.49.215.103,Desktop,,Velit veritatis odio libero dicta suscipit. Provident eius ea. Vitae asperiores quam et tenetur et.
2/25/2020 23:19,929.91,Nitara Bal,c7519d976e8dcfb21707c22c887394ed0dbc0a76bb9b29b8a3eb5a219d1f26e3,"Lalla, Chandra and Kibe",7623,Ranchi,USD,MasterCard,24-Jun,d7be6321b3d940822dd195bcc86cca411cd9d95f82301d04b84119671575a2d9,12,f431c0a2-8e10-4974-9389-167ac6be9632,0,None,In-Person,204.178.46.43,Tablet,,"Odit architecto tempore deleniti aliquid. Asperiores expedita occaecati fugiat at ea exercitationem. Placeat voluptas laboriosam omnis.
Et iste maxime error. Cum dolor reprehenderit optio dolore."
8/27/2021 03:15,1569.37,Parinaaz Venkatesh,430cd4e584e2643a5386400cc682cc1b78c98b78c89af23d5ac7010199f0d410,Bava Group,5290,Jamshedpur,USD,American Express,Sep-31,05ada863a4cf9660fd8c68e2295f1d35b2264815f5b605003d6625bd9e0492cf,12,302f5783-fcac-4e63-8db7-6eb9665fcd5d,0,3 or more,In-Person,194.208.169.249,Tablet,,"Fugit incidunt quia dignissimos sed dolore. Numquam delectus ratione doloribus accusantium delectus.
Itaque deserunt quisquam."
11/30/2020 07:48,1878.33,Mahika Kunda,f0513058044dd2c4d392f879532190dcd51967a86c7d95baf816aefd6af9a910,Madan-Sami,3137,Dhule,USD,American Express,29-Jun,f53f2fb9b99180ea02b1f345b6c862e6bdde16e3b82a6886be0234d09a0e1645,12,afdd90c1-480d-4308-9bf4-0759b3331e2a,0,3 or more,Online,183.34.222.25,Tablet,,"Incidunt tenetur delectus et possimus assumenda quos. Odit corrupti neque facere nesciunt unde id.
Quis autem blanditiis neque."
9/18/2020 07:57,4750.47,Uthkarsh Rout,a3ca767c48ff314b3d728b4acbae8423f6725ccd9cc34475bee54882112c6de6,Bawa-Bobal,1858,Bhiwani,EUR,American Express,26-Aug,e13b778ae833ca8c5d757c58e4a85bd71e08c05caedbd096e13ec3f7b228b43a,05,39ce50c4-eb20-4152-b9a9-cbf233e5a03d,0,2,In-Person,198.222.230.250,Tablet,miraan66,Consequatur nam voluptas et cumque officia illum. Sed officia pariatur deserunt repellendus. Error aspernatur corrupti blanditiis ullam.
10/4/2021 16:48,745.28,Miraan Bal,70a08355a21c29b357d315ed9babae157967fc516d59f399c52dcbc9eb70fc5d,"Iyengar, Brar and Kumer",8551,Shivpuri,INR,MasterCard,29-Oct,23e8b0175874e1bb3b4799e13a6634a8eddb456c1b8675b871e07ec09abc0c07,00,84a50bf2-941c-4381-92e2-5cdc00d3265c,0,1,In-Person,218.231.191.191,Mobile,,Quod ipsam corporis asperiores eaque quis eaque. Dolores magnam cupiditate aut quia veritatis ullam rem. Est doloribus totam voluptas. Atque eum alias nihil.
8/21/2021 09:31,2781.39,Trisha Dhingra,2443c4bb1a4fabe1eb4ce64ac21acadafd934a3f0bac9a0c7621f979b0ee1384,"Dewan, Sunder and Bava",8510,Ambala,INR,American Express,30-Jan,36c1cc2f9d7022bf6beacb6248a89e7e677b3bf9a91e6457a5ffdbade55b76da,00,d1c442cc-142d-4539-859b-7061561fc857,0,None,In-Person,139.112.238.172,Tablet,,"Voluptatibus officiis iste alias. Qui iste quae a.
Nisi architecto accusamus quod ut cumque. Dolores sequi optio ex est enim. Cumque excepturi et blanditiis. Itaque dolore nemo est."
6/4/2020 15:07,3602.35,Nirvaan Jayaraman,7afb51d71f13548a340dcbe909a58ed4a5fcf3671ec8ad1d190e8a6936f0d506,Vig-Kapur,5853,Thoothukudi,USD,Visa,24-Apr,86b700fab5db37977a73700b53a0654b21bdad0896914cc19ad70dee5f5fb3f6,05,5bdf63ba-0041-4771-808f-320c20a58e3d,0,1,In-Person,122.53.128.156,Desktop,,"Dolorum eligendi quis id. Nulla laudantium cum ab amet nostrum.
Quo natus maiores natus atque error ea voluptatum. Facere minus id incidunt perspiciatis. Nam facere esse sint tenetur voluptatem odit."
5/24/2020 23:52,1768.25,Kashvi Sengupta,4c0e56e3d957b3357ed6865482d3648756af9145017281fbbe9a27228d26e6a5,Saha-Joshi,2945,Rajkot,INR,Visa,31-Dec,f138665c5aa6600801452ebb40df70c46e73f2c51f4cb72f66b438139c5ec3f6,05,c3e679bd-f499-4780-a357-6a25bc94aa59,0,1,Online,136.7.238.238,Desktop,,Iusto corporis voluptatem dolore quae eaque reiciendis. Vel et voluptas placeat eveniet cum.
2/7/2023 12:45,195.56,Tiya Chanda,6c19080764069ac8c8a864de81266fec8ef6cb58a4ce5f3f3aa619cf65748e5e,"Badal, Kant and Kala",6912,Malegaon,USD,Visa,24-Dec,fadb19bfbddde11ed6828a22e742cc97f5589ce48ac8ec8f94a6510ad5f16b8b,12,ae3ef0ac-5ac0-46a1-b4b8-1c1291eb8fc1,0,1,Online,14.197.252.93,Mobile,,"Saepe aperiam magni porro numquam. Esse provident laboriosam.
Soluta incidunt voluptatum laboriosam unde. Quae itaque velit repellendus maiores consequuntur."
12/21/2022 05:54,3147.67,Eshani Ben,8a1890345c24e13f676d4663d2d39184225bf69745adf7696e2b8714014f0630,"Sarkar, Ramachandran and Bala",7219,Mumbai,USD,MasterCard,29-Sep,e5b861a6d8a966dfca7e7341cd3eb6be9901688d547a72ebed0b1f5e14f3d08d,12,7c846249-1202-441e-8b49-87679a9b60b0,0,2,Online,223.136.176.54,Mobile,,"Quae iusto rem explicabo eaque. Non a ipsam. Eveniet qui recusandae in quas.
Consectetur soluta ullam molestias eum. Quisquam ad labore officia."
8/2/2020 06:50,3270.95,Mamooty Keer,0487b5bd05a95876b5719654211b02aa8362c1146ca9db729e3eb2ed7f671219,Bandi-Bhatti,2923,Tinsukia,EUR,American Express,24-Nov,d86c993d110ef8006edd379e345f801f90ecc4561092e6c0d6209163f53c84e0,05,237476bd-27b5-425e-8e46-1d9d3f974c2d,0,2,Online,15.71.90.196,Mobile,ztank,Accusantium repellat temporibus esse laudantium. Exercitationem repellendus adipisci hic rerum tempore. Inventore amet asperiores excepturi voluptatibus sed.
10/21/2022 15:33,254.16,Samar Bhandari,6b95e4e3f4434f863f1454d39036e295026f836713e5e5a0f8b667e537c306fe,Ranganathan-Varughese,5931,Jalgaon,USD,American Express,Apr-31,a4e00d7e6aa82111575438c5e5d3e63269d4c475c718b2389f6d02932c47f8a6,00,d7e5b609-47e1-43ee-adb3-fc6a3a8edc37,0,2,Online,160.53.155.14,Mobile,,Provident nobis sed vel asperiores tempore eaque. Illo et autem aut cumque reiciendis. Ipsum possimus iure debitis at maiores omnis. Tempore quaerat magnam optio quo.
7/30/2021 11:56,2637.81,Darshit Kala,61ac37424d8b685a2b42950381bf555ef4832c3e36d9c51bc4a85cefa77070c8,Verma Inc,9539,Cuttack,INR,MasterCard,Jan-33,406b783f721b16ffbe467c444fae075231ec3a21b14cff2a8f376338a89e339a,00,0abf23ad-f6c7-4374-a4e4-8c42e1d94134,0,None,In-Person,162.84.2.229,Mobile,chakrabortykashvi,"Laboriosam atque animi culpa magni odio. Alias praesentium cupiditate repellat error sed deserunt laudantium.
Quisquam delectus aliquam deserunt quos autem. Eos maxime labore."
3/25/2020 10:24,3136.61,Zoya Mani,10ba9a2df3b564d538e7a8f4f3b5ef3fd18672ba47fbc79fced6f0d765c2b9d9,Shetty Inc,6843,Dibrugarh,EUR,MasterCard,28-Apr,c66bbe9d118f554bfdba35a609848b9ab2d9c22e6bed77be6f8a55e96c295549,00,65b71520-b041-4240-8285-49644a5559b8,0,2,In-Person,146.200.224.132,Tablet,romilmadan,Deserunt sequi id rerum. Nobis at odio suscipit illum iste. Aspernatur ullam id atque dolore.
8/21/2021 12:46,2628.52,Taimur Garg,2e5790fddbf343322d0c915a5d778251b524cecc8194643fa99b9ebd4c0f2342,"Viswanathan, Chandran and Ravi",2789,Bathinda,INR,Visa,May-32,e6fcc0253ed7a328a10eb6e2e1ad6abcad60c374c64dbac4b76da610085b43d8,00,1de73abb-9e46-4037-8987-05cfb6f4553a,0,3 or more,Online,182.99.127.216,Desktop,,"Ut repellat voluptate voluptate odio possimus expedita quas. Numquam corporis magni nulla commodi iure.
Sit libero eaque animi. Impedit nesciunt rem ut consectetur."
1/27/2021 19:12,4004.43,Raghav Bhakta,0c7ce1a944d434b90de840f7b741b4746c049cdab8a96a77e32df45c18e27dbf,"Buch, Kar and Gokhale",6191,Pali,EUR,Visa,27-Mar,72abdfcd75400cfee271e737b4f112e5f671d3691d215ed616db2ad8d5a7778d,12,58e79fa4-13a8-4235-a3b1-ce7e4828841b,0,None,In-Person,222.220.103.34,Mobile,,"Laborum assumenda quisquam dicta perspiciatis. Tempore ut facere corrupti vel qui. Fuga culpa porro repellendus quasi officiis.
Distinctio id voluptatibus dolore sapiente dolorem est aspernatur."
5/15/2022 06:48,4340.55,Kashvi Mannan,1f9e33fc7b754877d58782ef74dcc66b1259e3a88a94691886cd32c487cec703,Kuruvilla-Chand,8762,Udupi,INR,MasterCard,Apr-31,99ee50221221864d50c60baea6f14d8ac2e235cc6e78be6088cd40cc97fca394,05,2da45898-b166-4aa2-8b60-783f720d0ef4,0,None,In-Person,216.229.20.14,Mobile,,"Aut consequuntur quia nulla. Magnam ipsam molestias. Earum ullam quia veritatis ut.
Veniam sit minus accusantium quam culpa."
8/24/2023 15:28,2428.46,Yashvi Sangha,2cebe3731829c1f404ef01a99585ffbf77df9293d1e30c5350967a1dc1b55112,Konda-D’Alia,3755,Kalyan-Dombivli,USD,Visa,Apr-32,d970990220a1e7e9a1f80ed922d39173e252a34e3739720bbdb55ef3cd9f34b9,00,c396b825-c590-4c3b-874c-17583c83449c,0,None,Online,196.238.103.163,Desktop,,Consectetur est ipsam impedit optio. Ipsa sequi esse laboriosam suscipit ducimus. Esse reiciendis aperiam facere earum pariatur optio.
9/3/2023 00:13,2958.29,Dhanuk Gera,c68a122456fb48249551a0d423d4e25f69b8e7e2dc538cb9bff193f8d626d157,"Handa, Kala and Dar",2031,Bettiah,EUR,Visa,Sep-32,afa472a961fbcb09314e81b2c3eb19cd2d9fd7527582f43a3b8fd9d3ed6d893d,00,5db49a90-25aa-4902-9775-04c0d469f79a,0,3 or more,In-Person,144.143.202.242,Desktop,,Maiores beatae fugit modi maxime officiis eligendi. Magnam recusandae aut ab illum quibusdam minus libero.
5/16/2023 21:44,4726.5,Nirvi Trivedi,bc48bb82243f15e30092f957928e015cf41caaa87f341aa014a28516b8287c1f,Ram-Issac,6278,Suryapet,INR,MasterCard,Feb-31,5092c37bcbc9f0fb33cb0f9cab7aa5ae94ed0f1219773c380b143b7c1224d01b,05,4f79bec9-85e5-4431-9bc6-e3c528ae4354,0,None,In-Person,132.65.173.147,Desktop,ravelyuvraj,Totam quis inventore quam magnam nihil explicabo. Libero est eaque optio quibusdam odio. Architecto molestias officiis asperiores quo odio.
12/28/2022 11:30,4032.02,Veer Walla,6bc1e827b019c429898dc9a46ad2d8d7d0cc720e5b730fa75b904d47e8808ef6,Kala-Mahal,2657,Raipur,EUR,Visa,24-Aug,6165d33e490f91dbf808b194904d4f07c550d5e3a19c9e776e0c895136ec9fa2,00,65eee003-0ed1-4493-96e3-0b2ec9a3f0eb,0,1,Online,196.161.168.203,Desktop,,"Quis dolores odit ipsum molestias unde.
Minima id eaque necessitatibus aperiam voluptatibus. Harum voluptatem ut molestias numquam magni.
Velit aut tenetur expedita. Quasi adipisci ab fugit."
5/19/2022 11:13,3079.53,Stuvan Wali,c56d0b1d99c482eedd374402366eabb2d1440918912504c48d96bbd0f3952a1b,Gill and Sons,2416,Rampur,INR,American Express,Apr-33,5ef6514ed3304cf62b950982541114ac352c52729dbf80747775a9d1a733af93,12,e60e43c2-3467-4d02-9eae-a18f64140107,0,None,In-Person,141.47.137.181,Desktop,nirvi68,"Ab ea architecto perspiciatis maxime. Quam amet tenetur.
Consectetur doloribus quas rem.
Quaerat praesentium debitis pariatur cumque voluptatum fugit. Tempora incidunt debitis itaque laudantium."
12/5/2022 02:47,1156.27,Bhamini Kuruvilla,4f5defbfe7925a338850cb94100934896ec453aa4ebb70650ce1466229b4f1ee,"Bakshi, Tak and Dhaliwal",3991,Ramagundam,INR,American Express,29-Dec,8efbbe9bc19ad2e043c6cdb187c0a0fedde70b6458443ce0b5648ec04ccf4cdf,00,edf0f69a-9c92-423d-b33d-6cd72c1621bf,0,1,In-Person,140.7.23.178,Mobile,,"Officiis vel eum aperiam iusto. Maxime odio nesciunt nostrum impedit.
Quos esse ipsum aliquam ipsam. Omnis eum excepturi deleniti consequuntur.
Quasi dolorum maiores. Ducimus minima possimus."
12/5/2022 02:30,1070.63,Ayesha Brar,df45122906b8764ea7efaf229558ddf0a4eea65b5479b887cd12b7c1d66b784b,Hegde-Anand,1857,Noida,USD,MasterCard,24-Jan,c6bd343ae0007cdb979de7540f2668fe849d68ff47fa1a650a28f89104f41f1e,12,23167980-e73f-46ac-882a-27225ec774cc,0,2,In-Person,184.100.64.251,Mobile,,Eius dignissimos rerum voluptatum quos commodi ipsa. Quod similique nobis provident cum. Est quaerat accusamus modi cumque.
9/14/2023 06:41,719.38,Oorja Manda,412701c31becc35214d4b3c0486b0bde92e68185eb873831fcf0d8d43cb86b5c,Deep-Kakar,5119,Siliguri,INR,Visa,26-Nov,48ce32e8ec7741594c8786e445fbed501f5a735a49522314b8e24878e2544b9e,05,0d23f57b-70f8-4026-94cc-c159ac20f04d,0,None,In-Person,86.188.151.98,Mobile,,Dolorem accusantium officiis pariatur. Voluptatum cumque ex quasi fugiat nam. Omnis molestias nemo unde.
5/16/2022 13:49,3648.93,Kiara Lall,b37a83009a7015fa247d7401ca5cae18aa99397e9252ae38d79c2479182ad7cc,Anne and Sons,4338,Ramgarh,INR,American Express,26-Aug,f7abf2a084c3668c7b90654bf01205085e5d0219ffad0564904e5c923af11523,00,ef045558-38ee-4da9-bfb2-b8c146e3ed75,0,2,In-Person,190.199.118.4,Desktop,,"Facere enim provident placeat.
Explicabo dolor repudiandae illum consequatur earum reprehenderit. Voluptatem saepe quas saepe. Explicabo iste similique modi minima."
3/13/2022 18:12,4780.5,Jiya Hayre,adb8424a5d58c8ee39ca37e79a5fbacba6c60d8adac56b8dc0ce07358b114baa,"Malhotra, Ramachandran and Chander",1594,Gandhidham,USD,MasterCard,26-Mar,f7b856c054de7ccced087ad4f9413380ec494e40abc818b840aaad990ca3c5bc,00,e5d7349d-4075-4223-a9b6-9f72e12317b6,0,None,Online,48.97.10.171,Mobile,,Inventore id ducimus odit ut cupiditate. Ipsam cupiditate porro est ab consectetur. Cumque labore animi nulla voluptatibus voluptas delectus.
9/20/2021 23:50,418,Nishith Rajagopalan,12eeeef6ca506814a3818e0c988d63a867324a030415d65a35cf7ad4a97e3af4,Kurian Group,2887,Coimbatore,INR,American Express,26-Sep,48b361d46638bfa4eee090c158a750a69c7beec3a62e703e2801125551b1b157,12,3479758e-6b98-4fa7-8f7a-125ad2815d2d,0,None,Online,214.151.92.238,Desktop,,"Maiores eaque sapiente itaque. Natus neque nulla eum numquam atque soluta ipsa.
Sed atque praesentium sapiente. Quibusdam libero veniam officia aut tenetur."
1/11/2021 01:11,3687.66,Aradhya Lad,bd5d5f16e2ec341095ed655b53f7163e81ffa105461e3878ffbcef0a50677867,Gulati LLC,5468,Junagadh,INR,Visa,24-Nov,de498b9901677f58da56b38a515db0a6a3b93840bde5fd0b74437502163e9fb1,00,9518cb79-b77f-405f-acf1-70bd03465882,0,1,Online,145.163.106.121,Tablet,myra73,"Beatae id vel. Repellendus eligendi itaque fugit id.
Aperiam quos culpa recusandae assumenda quos. Doloremque sit voluptate perferendis hic culpa quidem."
8/5/2022 13:23,3914.4,Kanav Ramesh,a936a1e478487f537118dada57c5fe30cea9697ff75057c8aba3cc46473919d7,Chatterjee and Sons,9022,Amroha,INR,American Express,29-Jan,ce02d4b6d1aceeea96a562c10923d590607df6182b4a3405ad10be85b6354787,00,2716df52-25a4-4ecd-9e59-a1f3b3920302,0,3 or more,In-Person,201.92.248.56,Tablet,,Consequatur reprehenderit odio ipsum explicabo omnis maiores ipsam. Quas explicabo distinctio est ducimus temporibus quasi esse.
2/14/2021 02:05,45.02,Ira Srinivas,d5768015f41c56f19cbeb2831412bf821030e939cc9cc85d94f1cbdefa5fef35,Handa Group,9398,Ballia,INR,American Express,24-Jan,f6103ca1e01bd200a9258a366b7e8c22a542e771bf11a0679967a5bb47ef3688,05,f7ac547a-c9b1-44ce-8216-6ed72bdd4a56,0,3 or more,Online,197.243.51.145,Desktop,bbali,Maiores molestias rem velit. Quas ab animi aspernatur omnis aliquid. Adipisci possimus mollitia esse rem.
8/4/2023 15:59,629.93,Darshit Sawhney,6ccd9ff009109dec13fceaf712813d8564164dbcc143f46ad54663854847e5a0,Badal-Chaudhari,9260,Hyderabad,USD,MasterCard,25-Oct,24be8ee76308afb924abfaf26212411f2b66e53b9ce2534e5c9f88354c88cc39,00,95bbcf5f-b178-4380-8e4d-5e25cd365400,0,2,In-Person,137.128.168.193,Tablet,osem,"Id architecto magni inventore accusamus mollitia eaque. Perferendis quisquam ut.
Similique quibusdam fugiat laborum inventore. Iure provident et officiis."
9/1/2021 23:30,1359.52,Dharmajan Varkey,8b58676aa58f91acde172fa8f86aece5f7d6437880a3522e6edecc3a3c1228b5,Bera-Buch,1884,Malda,USD,American Express,31-Dec,865736a1c30a82dc67aba820360a01b1d9d0da5643234cd07c4d60b06eb530c5,12,0e9f4bd0-bb82-4c20-8169-b602a97cc183,0,2,Online,209.199.160.50,Tablet,nitya45,Harum sunt quia voluptatibus. Occaecati nesciunt vero. Ea repellat optio.
1/5/2022 07:25,1776.36,Heer Amble,0ceb1f2ec481b76c14375f772b2fb224f67560759b262707bfc4f1655c9df3bb,Varkey-Tiwari,3296,Chapra,EUR,MasterCard,Sep-32,d6723fa996ced47773f2dea29cce9b11f951e6dafe321a84ac7d32791c3b4660,00,fceaec45-663e-493d-bea6-04e1801f66b1,0,1,Online,210.26.108.114,Mobile,,Dolore a quasi eveniet. Unde dicta rem quisquam. Eveniet nam sapiente sapiente praesentium.
8/16/2021 18:39,3135.36,Aradhya Dixit,add0c6fe5190236ddc57fedf5cc2718e15d88c334619713675a381b66e65cdde,Balakrishnan-Varty,1082,Srikakulam,INR,American Express,28-Aug,97a6d21df7c51e8289ac1a8c026aaac143e15aa1957f54f42e30d8f8a85c3a55,00,5ed2b77b-007f-4b97-8edf-d8e0752669d8,0,None,In-Person,48.125.1.68,Desktop,,Odit cumque maxime dicta laborum. Unde laboriosam non quae sed. Non ex neque veritatis sit quaerat ad.
10/7/2023 09:44,715.59,Krish Bal,32180f37283687aead5059a8425b65a8bd80beb0abf389195bbb54f14d15f995,Bahl-Datta,8907,Guna,EUR,American Express,24-Oct,d970990220a1e7e9a1f80ed922d39173e252a34e3739720bbdb55ef3cd9f34b9,05,c23e253a-afc9-49d2-aa74-b2383bb71fab,0,None,In-Person,161.105.226.167,Desktop,,Modi repellat placeat doloribus. Accusamus repellendus dolor voluptatum minima occaecati.
1/15/2021 12:30,1397.39,Mishti Cherian,b1b9d3262af773c0d39024bf7f5283c85be4f33984f9fc34351277d8978861d6,"Gokhale, Doctor and Deshmukh",9484,Eluru,USD,MasterCard,May-32,a440868cf4311953cb45c7ded9360009e1bb77775b6395a3e13aa9ef831794b1,05,4b544f11-df77-4de7-a047-20d381f228b7,0,3 or more,Online,199.146.134.43,Tablet,,Vero nemo nostrum commodi assumenda repudiandae. Qui animi eligendi minima ex.
5/18/2022 02:40,1212.45,Mishti Magar,74f682350f160b7c317e13c8ff92a273f47a7e4bca70468aa7a0cbbe5c12c167,Thaker-Bajaj,7251,Ujjain,USD,Visa,27-Feb,6c0f3412848008d49d186d5fad7fd1482656cfb62ad3c060a14e41c3fb3f1b43,12,da8de419-0ade-4ad3-ae41-3dcdd3a5e21d,0,None,In-Person,148.118.199.127,Tablet,shalvsankar,"Nisi rerum nemo autem dolorem. Similique libero minima rerum quisquam corporis veniam minus.
Aperiam in corrupti ab commodi tempore. Esse tempore maxime veniam."
4/11/2022 01:49,315.11,Eva Bhat,c37e5464584e93c825801921d0eaab7339c0514a8d16763a3a2660c6001ca577,Kala-Krish,5746,Bihar Sharif,EUR,MasterCard,Apr-33,3cb65cad26f0a517866e06dcba59afa4a5eadf832404e0e17c707b928825c144,12,9eee34d3-8a5a-484f-be7b-b1d3439f842b,0,3 or more,In-Person,201.119.70.159,Tablet,,"Vel temporibus maxime odit maiores ex blanditiis. Harum quo earum adipisci. Animi quidem eos minima.
Iure amet velit magnam sed voluptate exercitationem. Ipsa dolor fuga occaecati."
12/25/2021 04:27,3659.2,Anay Kade,9fe8869c4d11a5bde2ee774596667c26a2abb324cacf5a2ac24cee201ef22316,"Sandal, Doctor and Kale",3914,Satara,USD,MasterCard,Sep-32,6ffbae9aaff664bd4739f51a6c7883a2c3ce74e9227a6aff728d0d57ad56f234,05,981b0303-e383-438c-a689-d0cffbaa40c2,0,2,In-Person,19.108.149.208,Mobile,,Incidunt placeat maxime accusamus. Blanditiis corrupti similique voluptatum repellendus commodi sit.
1/18/2021 21:18,773.32,Shalv Kothari,53b754343ad52004cdd04dfb1bda3d25538424b3cab8a7990f4c43e99ac4e202,Seshadri-Deep,4324,Kulti,USD,American Express,24-Dec,dbb1ded63bc70732626c5dfe6c7f50ced3d560e970f30b15335ac290358748f6,05,7890a40a-f775-40f9-a891-a74a70bc0267,0,2,In-Person,179.177.18.5,Desktop,keyatank,Quod ex magnam neque sed minima. Rem vitae quam eaque alias. Eius dolores accusantium saepe libero. Voluptate eos harum magni dignissimos deleniti molestiae.
2/28/2023 19:41,4735.45,Ela Saxena,e87b8b6364547124c19eee755e85c1131490072124b52a69fced9f05f3950107,Sehgal-Arora,5500,Tadipatri,USD,MasterCard,29-Apr,92a6a32f99def322d70ea1167a99c6859ab4e8bbc593b997ec5994d244a82475,00,09990282-590b-485f-962a-17935031b292,0,None,In-Person,204.212.211.76,Mobile,,Laborum tempore excepturi blanditiis odit. Inventore hic quia hic ea aliquam. Quis sunt omnis velit ipsa perspiciatis corrupti.
11/4/2022 04:25,755.02,Suhana Taneja,4f6cdec2e45c565bf4af7a3990260424a8408e23a8a43495841154d49b1f10ec,"Chaudhry, Sawhney and Gala",2579,Gangtok,EUR,American Express,25-Jan,67eab6db6703cdf9acf656bbb09640fcde2ff197786adbd9ae9c14936fc8d159,12,2d6b28dd-6746-4e7e-a0ea-7414b77f9942,0,1,Online,133.196.96.214,Desktop,,"Tempora culpa veniam quas dolores. Exercitationem tempore ducimus aut.
Corporis eius saepe voluptatem. Eaque ut accusantium laudantium doloribus."
