8/26/2020 07:34,1261.09,Jiya Sarkar,b19c7c3f6681ff6f15cc91f07176fba99a8387c9a61614b9c1338ddb6f11e85d,Gala-Lata,5147,Gwalior,USD,MasterCard,Apr-31,13671077b66a29874a2578b5240319092ef2a1043228e433e9b006b5e53e7513,12,e79777b3-ff70-48b9-b9dc-b2bbf1bd159e,0,1,Online,142.41.132.20,Tablet,anika74,Ab repellendus eligendi dolorum laboriosam sit dicta. In aut necessitatibus iure quibusdam voluptates doloremque.
3/29/2021 01:35,2111.8,Keya Toor,cde257731b8182c50fc114b59429e66c4db9e33653e57c41d8405a62c3ca249f,"Hayer, Arya and Arora",9804,Bangalore,USD,Visa,Jun-33,bc7d001b725557c76b0557936003c32bd3f2fc49f60fb9a29aaa342d25fdce4d,05,933bdbf0-09bb-43bf-b233-7f94fe0f784d,0,None,In-Person,204.193.36.47,Desktop,shamikbhargava,Ullam repellat quibusdam quos. Exercitationem repellat accusamus quibusdam voluptatem at maiores. Cupiditate aut non nemo et vitae modi.
2/5/2023 04:17,3240.35,Anya Shanker,ebdf22e86f8334fd39cd73ba1baf4b12ae8534ce805d20edd92150e0aa7196fa,Aggarwal-Iyer,5168,Aurangabad,USD,Visa,24-Sep,02c000a36dcd047f5738f5abfda07dc3b6d56fc44ea752c8f45b965f6fc04c1e,05,6945d23b-0a95-45c9-acb2-bd456516d975,0,2,Online,222.218.187.10,Mobile,jayantbawa,Blanditiis saepe debitis unde totam. Officia a sunt dolores iure quam temporibus. Aliquid deleniti recusandae suscipit fuga laborum quam maiores. Ea a non atque cupiditate.
9/12/2022 23:00,4321.72,Divij Basu,8209f3a342341f4f8fb9f9ad4819e932dd67bd0d6e01656063a308e030025bdc,"Subramanian, Khanna and Mand",1569,Morbi,INR,MasterCard,28-Apr,ce7d916f3b5c6edb421222b8e3b4c69f21bcdd5c38bac9e8a2751f55d865b9dc,12,ee3ca06a-85fc-43fc-8f28-5f61ffa4a3d3,0,3 or more,Online,141.209.58.127,Desktop,,"Quos earum veniam consequuntur nulla modi veniam. Deleniti rerum earum quis omnis debitis veniam.
Sunt repudiandae fuga omnis. Itaque maiores pariatur inventore earum quis explicabo."
5/26/2021 21:53,2201.88,Kaira Arya,9dedb5103d250e1e96c25f5d1c59fb0618cfc4118616557caabda46051455fa4,Koshy and Sons,1945,Dehradun,USD,Visa,24-May,72ba187b05e705de2dced5824d716a71872dedccf21f0c179bd2d5f2c7c974b1,00,d70751b6-0913-41b8-b6b1-dcd5fd77ae5e,0,1,Online,175.115.105.24,Mobile,,Veniam nemo quaerat recusandae nostrum hic vel. Sint expedita nihil eaque. Aliquid corporis modi nemo sunt.
4/10/2020 11:20,3802.98,Manikya Bhat,437c067b54295af014764d717f58e4efe611c588163284a9afbfcbe0be009414,"Mann, Kanda and Sankar",4490,Aizawl,EUR,American Express,24-Jul,219de1387a6743e583e805aad3bf0ffc69dc2107e6d233d43ee8ab62434729e9,12,8f747f43-8b9c-4499-8a5d-decfcb8b909c,0,2,In-Person,193.218.74.157,Desktop,,"Impedit ea libero dolore excepturi blanditiis. Consequuntur debitis quos hic nam magnam saepe. Impedit tenetur quibusdam necessitatibus odio.
Deserunt ratione cum delectus sunt deleniti culpa."
7/11/2022 19:17,3235.53,Kabir Acharya,c798ccd3bdf5b9d9de5cc167e3604d5acf7628a5b0ff875a39c01529870a4bf9,"Lanka, Date and Raja",8088,Dewas,INR,MasterCard,29-Aug,c22e1a4acbd2d996ff19a852585f9434883c30124f6b118eb9152fe4e5ee7994,00,93249894-3f19-4b3c-9a63-d87c80d242b3,0,1,In-Person,220.75.127.175,Desktop,,A vitae iusto. Tempora libero vero consequuntur voluptas eligendi. Soluta voluptatum esse eius temporibus blanditiis quae.
2/17/2022 20:33,70.48,Parinaaz Date,657274ffa7eac04b353dd03931735050952ed6886babdcb32229ba931a7840f5,Chandra Inc,5280,Shahjahanpur,EUR,American Express,27-Mar,74332c78b10e3ee51ac4a3c18ccc15c1b6c9807b3ca609969de5e3c361573dfa,05,93f2d3b4-4157-4266-a562-68c726d4557d,0,3 or more,In-Person,12.150.136.143,Desktop,,"Assumenda expedita rem ex. Repellat cum ipsa reiciendis dolores velit.
Sunt similique velit delectus quisquam quod nemo error. Aliquid autem dicta voluptatum aut."
7/13/2020 14:07,3995.02,Miraan Upadhyay,f49d62f784a141ea6f33b9eb5f8337476b5c886115806a5338f21e6c83b16aae,"Mani, Biswas and Khare",9763,Jorhat,USD,Visa,29-Feb,ec2e990b934dde55cb87300629cedfc21b15cd28bbcf77d8bbdc55359d7689da,05,7cc64d8c-c3ec-4c1f-a832-e911d3895c27,0,1,In-Person,218.103.211.68,Mobile,,Illo eius reiciendis enim voluptates incidunt praesentium commodi. Facere vitae eum porro hic autem ipsam. Placeat fuga amet quia sapiente assumenda cum eum.
5/26/2023 15:18,4201.3,Ayesha Chad,fa00912823ba8e2fc021f6a570554ec076cdd576a38b713f1aed24dbabbf8369,Sharma-Srinivasan,7914,South Dumdum,USD,MasterCard,26-Jul,e4be97ce765e6cfcd703884cc31db7478fa7befca7cf6dc15420ba20ed718abe,05,697d0ccc-2acb-4566-b5c3-9f7ab7211c31,0,2,Online,65.187.143.86,Desktop,heer74,"Sit reprehenderit minima. Voluptatem modi totam qui. Tenetur non modi officiis.
Molestiae nihil id ratione porro ex perferendis. Dolore velit alias mollitia mollitia dolor reiciendis."
9/27/2021 05:24,3260.7,Nitara Kaur,04d940b1b7e67778c54665ebf4405906fb53b5a82fd49c4bf8ab0c8838cbbbd1,"Rege, Kant and Lalla",5758,Vijayanagaram,INR,Visa,24-Dec,e0e3fcdfb0803ca538910c12042cb6232acb9e3c6db8908524aea6ed560e5334,12,9db4010f-239e-4a11-9922-64bfef1fb6ac,0,3 or more,Online,32.227.92.157,Desktop,,"Illo officiis nesciunt ad nisi est dolore. Aspernatur ex eaque dolorem nulla delectus praesentium.
Natus repellat rerum aspernatur. Assumenda aliquid vitae accusamus."
2/1/2021 18:30,1395.97,Purab Jaggi,695630d51ac444e8a95af914daa668d1e07a4f58c205700e38e4e942c62d7a66,"Kurian, Edwin and Gala",3396,Haridwar,USD,MasterCard,24-Jul,84a5092e4a5b6fe968fd523fb2fc917dbffae44105f82b6b94c8ed5b9a800223,05,73877464-e05e-4d5c-85c8-3441a52db61c,0,2,Online,144.168.215.77,Mobile,barmandhanuk,"Quam unde repellendus odio quaerat. Quam tempore temporibus nesciunt nostrum beatae.
Beatae aspernatur at. Perferendis tempore assumenda eius. Adipisci nam dignissimos aut."
12/17/2020 09:10,1637.79,Neysa Bains,f07300e47c0f07c32011e827ca520153d239137ccd4f8a4529cb4a97022907b2,"Saini, Sethi and Wali",1940,Siwan,EUR,MasterCard,Feb-31,0f8ef3377b30fc47f96b48247f463a726a802f62f3faa03d56403751d2f66c67,12,6d3a9e33-e94d-4bc5-9213-7073fbaa75f2,0,None,Online,168.254.227.239,Desktop,,"Pariatur saepe doloribus vel ex consequatur laboriosam. Quam soluta animi saepe.
Officiis fugiat iste perspiciatis odio fuga. Error voluptatibus id eligendi reiciendis ratione."
1/25/2020 03:06,858.91,Anaya Dora,0a83e39457b5efdfde5fa920cc0e63a7f1e3e1e7f1f0d73ee7c706d74828fe06,Sami-Bala,2602,Bhagalpur,EUR,MasterCard,28-Dec,e0f05da93a0f5a86a3be5fc0e301606513c9f7e59dac2357348aa0f2f47db984,12,2a4fbfca-fa68-450a-91cf-3832a3c04bb2,0,3 or more,Online,165.232.135.43,Tablet,karanabram,"In reprehenderit aut eos. Iure excepturi alias iure facilis.
Quos ea harum incidunt sint. Dolorem dolores officia a. Mollitia fugit ex cum."
8/19/2022 14:54,1119.42,Bhamini Solanki,e290016fcde2464c3a445d37615737064b06b6f482334c07c51f52f2f11342c3,Som PLC,3695,Arrah,EUR,Visa,27-Aug,db55da3fc3098e9c42311c6013304ff36b19ef73d12ea932054b5ad51df4f49d,12,d713a442-bb54-46e1-8ee2-6263ee366436,0,1,Online,27.204.69.181,Desktop,heer64,Itaque consectetur veritatis. Quas exercitationem atque voluptatum reiciendis.
9/26/2022 12:50,4315.21,Divij Rout,dc9b6bf29b14e7693a22917711436898ebdf68de74e7475a949332af60ace340,Dora and Sons,6803,Miryalaguda,INR,American Express,Feb-31,d874e4e4a5df21173b0f83e313151f813bea4f488686efe670ae47f87c177595,00,d22d964f-9c3b-4e57-b96a-f4960da37f0a,0,2,In-Person,83.19.20.201,Mobile,aaraviyer,"Enim accusamus magnam quidem cum optio. Rerum est cupiditate repellat adipisci. Doloremque quos et sequi mollitia tempore.
Maiores laudantium error. Dolor quaerat saepe ipsam et."
12/14/2022 15:12,73.27,Veer Dalal,06fabbbb3b1a76ab73cd25d07c32366421baa08d8b1dbf8b402aa98ec578cfea,"Kibe, Aurora and Tiwari",4739,Bhatpara,INR,MasterCard,28-Jan,b50d427a71ef5f98a1bdd4335b71d381dc6a3e937d899f87b92af24121bb9579,00,18eed706-58b7-4721-945a-9f3bcbf5b234,0,3 or more,In-Person,219.75.48.143,Desktop,,Ut cum voluptates. Fugit perferendis quam eius temporibus. Officia nostrum quas inventore vitae.
9/4/2023 06:49,4463.23,Ayesha Aurora,d11ae485c97600cb1a29b05b443aeb82176dcb4f5e84f00d0e44423e232f74a4,"Kara, Khatri and Babu",5889,Raebareli,INR,Visa,23-Oct,2b4da94214015b4281ac65905270bda4eefb97e08f5b4ae2f517b424ff77bfd9,05,495ba785-59ab-43dc-afbf-ddd775adbd33,0,1,In-Person,157.203.116.75,Desktop,,Maiores recusandae quam iste iste. Sed quas nobis doloremque.
9/30/2022 02:53,4745.09,Misha Trivedi,5dc53b5715b493a16bdf928904ef59c06af047f4e904cb7de7744bf1535f1d0b,"Brar, Bava and Shere",1957,Kakinada,INR,MasterCard,28-Nov,c403741c4121989ac12c0829be88b8bec6f27b270f3cf8a7be3fe72cba473897,12,f9926b63-f20a-4021-9961-826f7897e34a,0,1,Online,208.93.39.168,Tablet,kapurakarsh,Facere accusantium incidunt totam maxime labore expedita delectus. Autem quis dicta distinctio repellendus deserunt.
9/19/2022 09:09,582.36,Sumer Sharma,59b2721dc510a726b4e97cee700660401d118f8f0764ef3571090e76532d963a,"Dhawan, Vaidya and Thaker",5108,Bhiwani,EUR,American Express,28-Dec,f7c2599681e9284ce1c403459e22b730e997d67d16c45c4f593108e8372029a9,05,a5c25d87-73b6-4200-9228-429662489bcf,0,None,Online,150.118.82.232,Desktop,khushikuruvilla,"Amet quos quis beatae nulla doloribus iste. Quod omnis molestiae repudiandae molestias.
Non incidunt quis laudantium aspernatur. Quisquam voluptatum nulla ducimus."
6/26/2023 23:11,3039.62,Aarav Bava,a59d39480f25f0b56c8048e6bcaeb33150c3cc0c7804c6839a0da6d260e49f8d,"Ramesh, Jha and Acharya",4203,Karnal,EUR,MasterCard,29-Dec,f64f410744d9470ffe2d6b9ee6f042cdffcc42a745d2568146e8782ea828ff48,00,b027438e-026d-494c-a206-53230b797052,0,3 or more,In-Person,164.161.164.209,Mobile,,Ab deleniti sunt ab quidem animi. Placeat magni adipisci unde amet tenetur. Animi sint error explicabo aperiam in pariatur.
9/24/2023 14:37,2089.36,Jivin Loyal,549b2bbc2f78741cce7943c9f9324e07a28f7d306f777e2f4f1acdc2a9b6aa31,Kurian LLC,1284,Visakhapatnam,EUR,MasterCard,Aug-32,0dfcddb0440e967f05bb68ca09a5e2188b8abc36bfb5b95b83b88be59c42c6e7,05,506bd572-27c3-4077-ab7b-ac5361d8f6b5,0,3 or more,In-Person,151.213.48.70,Desktop,,"Tenetur asperiores reprehenderit labore vel soluta officiis. Doloribus dicta quos.
Soluta ipsam culpa cupiditate."
10/8/2023 06:03,2298.61,Fateh Bir,13ac3f87093f8e006779f297163de57e584485377b6de4d3e49c0679904e7f38,Sekhon LLC,9197,Chandrapur,EUR,MasterCard,29-Feb,749fc650cacb0f06547520d53c31505c8156e0a3be07073eddb2ef3ad9e383ba,05,b8495d80-62d9-4e9a-a8d5-a5a7c96c4fd3,0,None,Online,211.186.66.6,Tablet,,A fuga alias omnis mollitia. Molestiae doloremque voluptatibus eligendi. Voluptate doloremque voluptas unde.
7/10/2020 06:14,335.61,Ela Chaudhuri,190682c14fac3395da6ca7b89c25ea284489cca1be46ffe6d78f86ca0c9451f7,Bhalla Group,5891,Gwalior,EUR,MasterCard,31-Jan,5538e771949ffec150f6e8260b2e3801236c7373ed62c22a3f82dc0071265cc4,00,5ea2964a-d5fa-4904-a21b-30e0897c6f6f,0,None,Online,32.251.10.179,Desktop,,"Amet iure deleniti pariatur. Qui nisi quae officia aperiam maxime atque saepe. Consequuntur quam iste soluta deserunt.
Ex voluptates laborum ratione soluta odit nostrum."
4/12/2022 14:15,4925.6,Charvi Kari,1f0af5b13a8e0386ec61a3d4553bf5e5efc2ea4e80229e9b196c71dbfc9fc6e7,Shan and Sons,6293,Jammu,USD,American Express,30-Jun,7f3ee9fe1fbf452b0c242614e1cad18b6dce034e5bc80763dff6332e872ad2ff,00,379b315d-a3f6-4354-a0ba-80579e015cac,0,3 or more,In-Person,157.73.5.93,Tablet,abramhegde,Fugit explicabo accusantium reprehenderit eos tenetur laudantium at. Fuga eum eum voluptate totam voluptate consequuntur. Natus quas voluptatem reiciendis earum vitae fugiat cumque.
3/27/2022 06:56,4241.67,Shlok Tella,f0335ab558fabbdc64829bfa8ab4e1d095f3003ae633778afd14a6df5a3304a3,"Krishna, Shah and Hegde",4564,Durg,USD,American Express,26-Aug,da6813d10025369ac0411363a16ab750adb21c6d0b38a03a9fc5ce58134da875,00,69183873-513b-4b0d-a08f-a9a413028b3a,0,None,Online,135.125.41.144,Mobile,riaan80,"Possimus vitae in. Dignissimos quod possimus laborum commodi. Hic numquam eveniet fugiat fuga eos suscipit.
Pariatur deleniti eligendi impedit veritatis et."
8/6/2023 10:01,1233.47,Misha Mall,4a72b4d08816abb61009a0711c20d9502e84823ce1f95fd042c6cd5114fcd6c4,"Mallick, Dash and Wable",2286,Sonipat,USD,American Express,30-Jan,c62510afc57db491f9f993387b76dd9a7d08f09c01326953904b6586c19c4b8a,05,85576cf7-263f-4ee1-86f5-e5e017b53dc9,0,2,In-Person,207.109.13.247,Mobile,bariamiraan,Deleniti blanditiis veniam soluta ex modi fugiat. Consequatur quaerat nostrum consequuntur.
10/17/2021 18:01,2012.85,Shalv Johal,1c072013294471f5fda9d802a602296b1115617450352c2cb089c61ff23c0344,Dhillon-Sinha,9441,Bhavnagar,USD,American Express,31-Aug,e4e549408422875958476160732390defefcac7c2bd8353d918fe452d20de2a6,12,72ffaa09-93b3-4199-94ea-53f2150609c9,0,None,In-Person,215.154.74.122,Desktop,,Sunt saepe blanditiis voluptatum deleniti ipsa voluptate. Magni cumque praesentium officiis accusamus ipsam. Ullam corrupti cum earum.
2/26/2020 05:23,2840.21,Mahika Batta,d2dcdb680904872625eeb834e49dfb2f2efc8e964c2a6f27fc141c230a38d5d0,Chand Ltd,3599,Panipat,INR,Visa,May-33,bc52dd634277c4a34a2d6210994a9a5e2ab6d33bb4a3a8963410e00ca6c15a02,00,dae67a70-c3e0-4141-b885-28c86103053c,0,2,In-Person,135.161.250.4,Mobile,omadan,Odio quisquam temporibus amet tenetur dolores voluptatem consequuntur. Numquam vero nam. Harum aliquam totam voluptatem laborum deserunt.
6/21/2022 20:29,795.65,Ritvik Rana,590225fc469f6f85086b1267edad5b7f43b646cd14e49e93fdc6a4e03c7dfc32,Vala PLC,5335,Aligarh,EUR,MasterCard,23-Nov,fce86e339dc3131c489202ec3b6c8d4319c61f152b3541ba0e4141e5d5c3fac3,05,64c4af18-2012-4ca3-869e-d56df88d7da9,0,1,Online,64.117.234.200,Tablet,bhavin93,"Perspiciatis provident tempora.
Ipsam maiores optio totam illum accusamus ipsam. Excepturi tempore nihil eligendi."
9/6/2021 09:26,769.35,Yuvaan Tandon,5046fb49617f405b23d808b8890d852626eb215db5d5695a96a921b15f18f334,"Sengupta, Dhar and Biswas",6445,Noida,USD,Visa,23-Oct,5dad6478e152b8aa33dc6a2c27992d26c0a6873d6ed1407a7e6efddca3985122,00,13242c63-270a-4363-b7fb-8532f24f01f8,0,2,In-Person,172.0.86.104,Mobile,,Ipsum dolor error rem. Illo nihil similique facere sapiente voluptas. Error quam ipsam dicta.
11/27/2020 15:39,3946.83,Vedika Virk,e2aa5887447dec7e86b8c5600f76c481fd8b13abe2412f6bdbc8ade1a7a61713,Kohli and Sons,6034,Belgaum,INR,American Express,26-Aug,f0ccd8e78b618cb55731054911af540b5496f37e94026cd20dae22363089b2e9,00,8d6324c3-b8f5-4e4b-b4cf-0ce55083f70d,0,3 or more,In-Person,149.135.102.238,Mobile,,Nam magnam architecto dignissimos nemo eos officiis. Aliquid eos eaque quasi odit provident.
4/25/2023 09:17,96.91,Nishith Badal,ba7b9b4ca8d6bebf3f2c25f392451f78f22cf62eb59e85b50da88988831c2ad0,"Batra, Karan and Sathe",6704,Aurangabad,INR,MasterCard,May-33,2f1d593cd98cb5bf81eb9d880221122342784ac5fb7f41f2b137006bafc92e39,12,f4383fbf-18fd-4ca8-9165-c96d78fa4f2c,0,3 or more,Online,179.84.44.25,Desktop,,Minus corrupti similique hic. Accusantium facilis sequi repellendus velit expedita dicta. Non esse eligendi dolores quaerat. Nostrum exercitationem expedita tempore neque.
12/26/2020 01:16,2514.09,Damini Zacharia,43d0912618f2139b7eb0ddcd5bd8e231149bea4b8425042bacef9af17be9332b,Kata-Ram,9568,Gulbarga,EUR,Visa,30-Apr,6db6eb4af1e18ab81d3878e44672185d60ca8c988c9e2f7783de220735534c33,12,abdd7270-ec16-40cf-ae53-43c8c1aa4f89,0,1,In-Person,171.142.123.129,Desktop,,Eos ab praesentium rerum repellendus voluptatibus amet. Quaerat nobis illo porro voluptates inventore voluptatem. Necessitatibus officia id maxime deleniti eos doloremque.
7/18/2022 00:01,4011.03,Indrans Raj,5293ca3138273c2cf3560771f7c07524f3b4109fd0823e672c16f70b84b05a05,Chaudhuri PLC,8173,Adoni,EUR,American Express,27-Oct,6d976934be74941fba578b143ba964eded443d10384e3f3d62a1ba7b4d339df8,12,3196421b-c6ec-41b0-a877-4f23a7f38630,0,3 or more,Online,132.77.78.242,Desktop,,Neque maxime blanditiis eaque quam vero vitae. Blanditiis hic odio nihil quisquam tenetur. Accusantium voluptatibus voluptas dolorum eaque quos totam eum.
5/7/2022 15:08,2015.87,Piya Sengupta,d518c73de0ac2a6858f6239f7cb6da97b3055968e8beb9ad10f12aa5d6e8c89a,Dash Inc,6914,Akola,INR,MasterCard,29-Sep,3c241d2674142a5f160c29ede81c822e8a834b88c254dff24c0ed4eb313970a7,12,f038ccb1-aa32-4903-b12a-8d23e4c60fb2,0,1,Online,84.126.221.130,Mobile,,Quisquam quidem rerum eum amet magnam pariatur. Tempore dolorem sed excepturi ducimus dicta. Asperiores voluptatibus optio porro dolor sequi. Ex explicabo adipisci.
10/16/2020 02:14,98.04,Pari Kadakia,55dc3a06f2e37cdff5099eeb812f2927225a06b45ccd627a76f7c53854f808f8,Gole-Balay,1132,Belgaum,USD,MasterCard,27-Feb,1c63ed9164d61acfd1f4f3a7b6dfacbd98d1dc01e755b7b558c6af0491154a2e,12,32d692ca-2690-4b96-b5cd-1f6cf7dd9310,0,2,Online,170.83.106.207,Mobile,,Incidunt laudantium similique illo vitae in. Excepturi consequuntur reprehenderit provident deserunt. Ratione inventore adipisci officia error temporibus ex.
5/10/2021 08:06,2017.61,Miraan Saha,fb0b2350861d890e139dea6da3b7210ef2b374830f493e472ebe42dadd700aa4,Bhargava-Subramaniam,6209,Arrah,USD,Visa,30-Apr,b301d8e98abdfad61a7e62e29bc0022ac55cb3b6d00b5b51d5223a4618c3bab5,05,3c0b071d-308d-42dc-a03c-10b9eb8d113f,0,None,In-Person,160.205.112.79,Mobile,asaran,"Repellat molestias placeat. Ut dignissimos consequatur suscipit.
Provident cumque nemo voluptas adipisci. Amet at at quam inventore dolor nobis. Nam perferendis vero consectetur quibusdam minus sed."
8/22/2020 08:10,1493.58,Anvi Rao,e0d6526c77af07f9aa81a351502320736ce1f11ef9f8222cd32fad6f69a909f0,Soni-Kuruvilla,6012,Tadepalligudem,USD,American Express,28-Jan,24be8ee76308afb924abfaf26212411f2b66e53b9ce2534e5c9f88354c88cc39,12,fc133d9c-cc3d-42d5-a7bc-7a71aeddeed2,0,1,Online,65.102.10.89,Mobile,bhavsarkanav,Consectetur impedit quibusdam earum ab harum tempore. Doloribus saepe libero laudantium nihil molestiae.
8/7/2023 02:08,2067.78,Nishith Seth,be626059d68e500dad9a6cee754ab49d4b701d05efe08f0f4731820f6fe93d47,"Uppal, Dhaliwal and Magar",3927,Ballia,EUR,Visa,25-Oct,dae40fcfed8e9ce405c3e0e207ba4781acb0a6a55a527f591b6b2b442f8cbbc5,00,8c13a20b-275b-487f-a934-1ebbc31414f9,0,2,In-Person,108.14.63.245,Tablet,,"Expedita sunt sit culpa minima rem distinctio. Quasi sequi perspiciatis deserunt saepe nisi.
Aliquam dolorem incidunt voluptatum explicabo. Voluptatem libero pariatur illo illum."
3/5/2023 04:58,1972.5,Lavanya Dhar,e91ce3db315d4a06a437b007c8db2046ffe233b835482d976629f93223919092,Sood and Sons,4186,Malegaon,EUR,MasterCard,31-Oct,62a0eae98b9fc0bd0ad941ae07ae5e2af545a64c8ddc43407bdfe6ae82addb4c,12,135abc39-ecfe-43d7-8de2-f26a02933f48,0,3 or more,Online,200.203.126.137,Desktop,shanaya51,Harum error nostrum hic ratione architecto occaecati. Dignissimos pariatur fuga qui.
9/15/2023 07:38,1149.53,Aaina Kashyap,503314266bcf0cab7dd68e5aad3f968fabda0e3c58e5bc9f24d62b23f5192e69,"Lala, Bajwa and Jaggi",4863,Sri Ganganagar,EUR,American Express,27-Feb,40f8d6d22b99ea3388538fd60bbf532256434b0eac401df1d9a2bdbb29354ae8,12,536c784a-bd5c-40f6-adb4-bd47b3f62719,0,3 or more,Online,81.134.103.102,Tablet,,"Sapiente facere accusamus consectetur quia nisi minus facilis. Nemo eos cum facere nulla nesciunt. Excepturi tempora neque officiis.
Cumque maiores ut. Autem neque voluptas iure nesciunt."
11/10/2020 11:58,2763.82,Sahil Agarwal,528afa3d3c0c045b84c8db382c32604379d3b49eaa9f44c7570325cecf257743,Thakur-Mander,4239,Belgaum,USD,Visa,27-Aug,620c9c332101a5bae955c66ae72268fbcd3972766179522c8deede6a249addb7,05,e5c8084b-d1e3-4cb0-b0ea-a875f849bf42,0,2,In-Person,218.204.19.146,Tablet,,Atque fuga modi accusantium totam eligendi asperiores. Quidem ad dolorem aliquam doloribus similique assumenda. Sed incidunt odio quos quae.
3/10/2021 08:08,3197.1,Veer Mander,7d964026b1716dec2d70262331056c1f46f092e1de31dad472a0b122a95a6c93,Ramaswamy-Kuruvilla,3042,Vijayanagaram,INR,Visa,26-Sep,5d8f6cce532a7aeb57196be62344095936793400b3aeb3580d248b17d5518a86,00,aa488eb2-d2aa-46ec-afb9-8662fdbf3bf2,0,1,Online,205.132.145.236,Mobile,zaina66,"Accusamus animi suscipit rerum. Consectetur molestiae in velit deleniti asperiores.
Quam laboriosam quam. Ex numquam nulla numquam facilis a. Error ut rerum."
9/2/2021 07:13,2052.55,Jayan Dasgupta,11a1f86b2edd07c8a2c90f83cf40d37117697e9b912801f1fbdd5dae3c3318fe,"Brar, Choudhary and Tiwari",2319,Naihati,INR,MasterCard,25-Sep,4621c1d55fa4e86ce0dae4288302641baac86dd53f76227c892df9d300682d41,12,b26b41d3-ca5e-418a-809e-a6947dbd0f9d,0,2,Online,192.120.31.141,Desktop,sakshammall,Quis ex similique magni iure ducimus. Rem quasi necessitatibus molestias cumque enim veritatis harum.
12/30/2021 10:46,4629.67,Ela Hora,2a3e397d635c1d8415236034aa4d89399998b38fd3e14585fbfbb47ffffbd67b,Tak Ltd,3010,Moradabad,INR,MasterCard,31-Jul,04d19fde0a08b17aca69491e714bea43565384d12a63626e08477662cc03780e,05,6a84aae9-495d-46ee-8f1c-21023a3a9721,0,None,Online,59.139.105.177,Mobile,,Nesciunt velit cupiditate soluta distinctio. Nam provident dolor ullam corporis quam.
8/10/2020 20:17,3417.69,Aaryahi Dutt,32cd004e893264297541491624e2d4e2519ec4257d73aae1cc6f508abbb844c7,Kade-Kakar,7659,Chittoor,EUR,MasterCard,Jun-33,e73cb135243c08ab2c2adc333b150b9237093315f6b38e3361f07caf2bfb4d6b,12,94250e6d-6a24-4525-a11e-b5cc6efe5dd9,0,1,In-Person,162.234.72.58,Mobile,advik97,"Vero ab praesentium alias iste suscipit. Neque quasi quas iste aliquam.
Quasi molestiae veniam incidunt vero autem ab non. At repellat maiores at libero vel quos. Nemo neque numquam velit."
5/24/2023 13:53,173.19,Charvi Bhakta,469eef8a6d2fb555dd8f5ebd0dba15dd14b0a503ed1de48d23a9d51d9579181a,Dara-Mallick,5708,Singrauli,INR,American Express,24-May,a3aaf5a0e9ad2901ab35ce73910be7fbbe1731a3ed1ff947a6ac395c5024a8b3,00,df2024e0-e0b9-487f-af6e-684760270981,0,3 or more,In-Person,38.239.184.205,Tablet,,Asperiores praesentium quibusdam officiis facere. Dolorum praesentium quo ipsum nemo laboriosam porro ipsam.
8/14/2023 15:54,2685.65,Farhan Bhardwaj,bc18190d2988fc94d20642346d0fbcb1cdec5887dfb944b394e01b21eed41313,"Raval, Sachdev and Som",4080,Tadepalligudem,EUR,Visa,26-Apr,3c1b7053f0edd447b778edbc0ad8359b0fa892d69857d9bd5e6b19007bb3f01e,05,46547f3c-c675-47fb-a0c3-3cbd52463f71,0,3 or more,In-Person,193.38.43.51,Desktop,himmatsunder,"Vel quod repellendus magnam harum atque.
Provident rerum doloribus commodi dolorum at sequi dolor. Distinctio nulla quo quisquam maiores quod accusantium. Est quaerat quae asperiores."
10/14/2020 10:25,4170.62,Divyansh Wagle,82b255143df1727f2cc6ab460b0f620c852402065d05d7947569a7e377dc02c5,Ratti-Upadhyay,9307,Kamarhati,EUR,MasterCard,Jul-33,68519a9eca55c68c72658a2a1716aac3788c289859d46d6f5c3f14760fa37c9e,05,1fed8162-1d20-488c-8bcc-2456e5cee094,0,None,Online,24.26.70.46,Tablet,,"Hic velit neque enim. Ipsam expedita commodi quam quaerat architecto neque.
Esse vero maxime culpa voluptatibus.
Nemo nostrum voluptatibus. Ut quas harum excepturi velit nisi iusto."
11/22/2022 06:53,4361.83,Khushi Kala,5aae372a0337b280616f1fc6bf22aa2ee818ae3e786150cf4b62994528a01983,"Bahl, Taneja and Seth",9417,Surat,EUR,Visa,28-Oct,684fe39f03758de6a882ae61fa62312b67e5b1e665928cbf3dc3d8f4f53e3562,12,d3ffbaf7-c175-4898-a16a-e191898bfc9e,0,None,Online,195.180.64.201,Desktop,,Molestias recusandae consequuntur illo culpa temporibus veritatis. Nobis officiis quidem necessitatibus. Suscipit dicta laborum occaecati.
7/8/2020 06:09,3548.38,Hansh Krishnan,640621c3656beb8ceae6e917c5016987ef1e66032f1ae488dcc2567a57068269,"Chokshi, Dasgupta and Sathe",7433,Yamunanagar,INR,Visa,23-Oct,000f21ac06aceb9cdd0575e82d0d85fc39bed0a7a1d71970ba1641666a44f530,05,c2e93363-a3fe-4a48-bc05-a7703bd6faa4,0,1,Online,199.70.45.7,Desktop,,"Neque consequatur quas similique.
Voluptas fuga minus porro fuga. Beatae veritatis velit fuga eligendi iusto adipisci non."
1/24/2023 19:17,3691.72,Tarini Lal,4d7a2007611b11dada2d6c188ee84795e20c0b57f5aaac984b9b754db7866cbc,"Kade, Salvi and Sen",1044,Karimnagar,USD,MasterCard,26-Jul,a4e00d7e6aa82111575438c5e5d3e63269d4c475c718b2389f6d02932c47f8a6,00,c8e18790-a0dd-41ee-9db9-4bd3eb091be5,0,2,Online,12.12.17.57,Desktop,chaudharimyra,Soluta nam harum aliquam totam harum enim illo. Nulla corporis eaque eaque. Rem recusandae dignissimos nobis.
9/23/2023 20:38,1813.01,Kabir Sahota,a8db5d00dbfc70b202a2cb0e5a92c40d548167fc8efe9cf0e487cc47639b000b,Soman-Sundaram,4249,Secunderabad,USD,American Express,28-Jul,6a97982dccf77dd3dafa27fcbdf75c017301f730ba186b1d9e8ea212eee73f54,12,b1f6e3b2-21a6-4ec0-bacc-374597d31675,0,1,Online,207.48.162.151,Tablet,lalnehmat,Voluptatum fugiat consequatur est. Culpa natus reiciendis enim. Alias architecto accusamus quis. Aliquid esse repellendus blanditiis eveniet.
9/16/2020 04:18,2853.15,Rohan Balakrishnan,9ec34d205a89ca809a31a681e7d451e4746932738aef11eb6fcdc3d08acefd83,Tella Ltd,5626,Mira-Bhayandar,INR,American Express,Sep-32,fb8a0d2da8683cec6cc64542f95ae11e085c72d56c744b2be5be335295976610,05,a5ef611d-1f32-4416-9bf1-8f23dbc13d82,0,1,In-Person,73.54.166.53,Desktop,,Minima ullam saepe. Fugit accusamus aperiam error. Quo omnis laboriosam odio nisi cumque repudiandae dicta.
11/28/2020 16:44,1767.78,Divit Kumer,2d77ee7c9cdf09bf8877dc027177e3218b7c3e1d62a53dc7e3b032ce09c671a5,Kala-Bal,6541,Machilipatnam,EUR,MasterCard,24-Mar,084917af148384c1e8396addcec2fca2a9f2c3918cad9676e12cdaad7dc7dfb2,00,dff72187-54be-4d14-a49b-4ac94ae33bba,0,3 or more,In-Person,141.43.23.47,Tablet,,"Porro vel omnis animi. Doloremque placeat quasi.
Dolore sapiente fuga aliquam ad aliquam corrupti.
Eveniet suscipit quasi vero ipsum vitae.
Odit expedita eaque. Perspiciatis harum a minus."
4/20/2020 08:42,1700.45,Neelofar Swamy,540ed9b392de0e94a3064a9eaff0534d5cf876f516761f821a40d2dfd6065d4d,"Rajan, Ratti and Behl",6851,Gaya,EUR,American Express,25-Mar,8f97d9164b8fa131f0361abbe49fe706d3abfd77663ed7939ee20d361a0c6a67,12,40aa70f0-87d5-4602-a24c-0c210e9bf7a0,0,1,Online,13.138.209.46,Desktop,,"Unde saepe harum voluptas cumque laboriosam minus deserunt. Fugiat ducimus accusamus quae assumenda.
Quae asperiores perferendis sed ipsam. Eum velit fuga eum praesentium quos molestias."
11/13/2022 22:56,1455.6,Arhaan Ravi,8735d64e2e4b66d8f5600a1babae5d7f160c9f3d6e5dff9d953f855529ee9328,Badami-Khatri,2711,Nandyal,USD,Visa,31-May,35254aa9a21444e50349cebb5465b9b42cb4a625ebcbffe24504b178c35bcb85,00,bea7acea-a27a-431a-8791-208decac1847,0,2,In-Person,217.113.40.82,Desktop,sakshammammen,Consequatur occaecati quidem placeat optio consequatur vitae. Itaque explicabo saepe nulla iure aliquam pariatur. Ipsam earum deserunt minus.
